{
 "subject": "qiyās: definition, arkān, masālik al-ʿilla, qawādiḥ, kinds, scope, tarjīḥ",
 "status": "candidate",
 "provenance": "Extracted from the qiyās chapters of the pinned corpus (Rawḍa, al-Ṭūfī, al-Kawkab, Iʿlām, Ibn Taymiyya, al-Shinqīṭī, Ibn ʿUthaymīn, al-Saʿdī) by an LLM agent; every excerpt re-verified verbatim against the cached witness (letters-only comparison, start and end) and every OpenITI locator against the next page marker before commit. Claims are summaries and await human review (Review.tla).",
 "works": [
  {
   "witness": "openiti-rawda-shamela12010",
   "chapter_span": "src:openiti-rawda-shamela12010/v02:p140 .. src:openiti-rawda-shamela12010/v02:p332",
   "notes": "Bāb al-qiyās opens v02:p140 (definition), ʿilla/manāṭ p144-150, ḥujjiyya p150-184, masālik p191-233, shabah p240-244, qiyās al-dalāla p246-247, arkān p248-300, qawādiḥ (12 questions) p301-332; Kitāb al-ijtihād follows p333. Tarjīḥ of ʿilal is separate: \"fasl fi tarjih al-maʿani\" v02:p397-401; jalī/khafī defined in takhṣīṣ chapter v02:p077. Edition footnotes are not in the OpenITI text (only note numerals)."
  },
  {
   "witness": "openiti-tufi-shamela10781",
   "chapter_span": "src:openiti-tufi-shamela10781/v03:p218 .. src:openiti-tufi-shamela10781/v03:p574",
   "notes": "Matn (Mukhtaṣar al-Rawḍa) is printed at the head of each section, followed by al-Ṭūfī's sharḥ (\"qawluhu ...\"). Definition v03:p218; arkān & manāṭ p226-245; ḥujjiyya p245-290; conditions of aṣl/ḥukm/farʿ/ʿilla p291-340; masālik p356-423; shabah p424-435; dalāla p436; scope (asbāb, ḥudūd, muqaddarāt, nafy) p448-457; 12 questions p458-574; ijtihād starts p575. Tarjīḥ qiyāsī v03:p713-720."
  },
  {
   "witness": "openiti-kawkab-shamela12019",
   "chapter_span": "src:openiti-kawkab-shamela12019/v04:p005 .. src:openiti-kawkab-shamela12019/v04:p396",
   "notes": "Matn (Ibn al-Najjār's Mukhtaṣar al-Taḥrīr) is in double quotes inside the sharḥ. Bāb al-qiyās v04:p005; arkān and shurūṭ ḥukm al-aṣl p011-038; ʿilla and its conditions incl. naqḍ/takhṣīṣ p039-104; shurūṭ al-farʿ p105-114; masālik p115-206 (ijmāʿ, naṣṣ, sabr, munāsaba, shabah, dawarān, ṭard, manāṭ terms); divisions of qiyās + ḥujjiyya + scope p207-228; qawādiḥ (25) p229-358; jadal p359-396; Bāb al-istidlāl p397. Tarjīḥ of qiyāses in the taʿāruḍ chapter v04:p716-735."
  },
  {
   "witness": "openiti-ilam-shamela11496",
   "chapter_span": "src:openiti-ilam-shamela11496/v01:p102 .. src:openiti-ilam-shamela11496/v02:p044",
   "notes": "No formal uṣūl chapter. Main qiyās blocks: Qurʾānic qiyās (ʿilla/dalāla/shabah) v01:p102-116; pro-qiyās arguments v01:p151-173; deniers' arguments (\"qālū\") v01:p174-249, incl. \"tanāquḍ ahl al-qiyās\" p204; adjudication p249-263; \"laysa fī l-sharīʿa shayʾ ʿalā khilāf al-qiyās\" (Ibn Taymiyya's answer reported) v01:p289-v02:p044. Aḥmad's 5th aṣl (qiyās li-l-ḍarūra) v01:p026. Takhṣīṣ al-ʿilla remarks v03:p027."
  },
  {
   "witness": "openiti-radd-shamela7626",
   "chapter_span": "src:openiti-radd-shamela7626/v01:p115 .. src:openiti-radd-shamela7626/v01:p121; v01:p200-212; v01:p371-373",
   "notes": "Al-Radd ʿalā al-Manṭiqiyyīn: equivalence of qiyās al-tamthīl and qiyās al-shumūl; middle term = ʿilla/manāṭ; muṭālaba bi-taʾthīr al-waṣf as the greatest objection; nafy al-fāriq; shabah; sound qiyās never contradicts text."
  },
  {
   "witness": "openiti-nuraniyya-shamela21729",
   "chapter_span": "scattered (v01:p232, p254, p292)",
   "notes": "Al-Qawāʿid al-Nūrāniyya: no qiyās chapter; applied remarks that rulings deemed \"against qiyās\" (muzāraʿa, planting in another's land) are the sound qiyās."
  },
  {
   "witness": "shamela-282",
   "chapter_span": "src:shamela-282/v01:p379 .. src:shamela-282/v01:p492",
   "notes": "Al-Shinqīṭī, Mudhakkira (commentary on Rawḍa): bāb al-qiyās p379; arkān p421; qawādiḥ p442-492 (naqḍ p453, qalb p469, muʿāraḍa p471, tarkīb p479, qawl bi-l-mūjab p480); tarjīḥ p493. Modern: excerpts ≤160 chars."
  },
  {
   "witness": "shamela-9885",
   "chapter_span": "src:shamela-9885/v01:p291 .. src:shamela-9885/v01:p375; appendix p403-427",
   "notes": "Another edition of the Mudhakkira (al-Jāmiʿa al-Islāmiyya) with an appendix (mulḥaq) on qiyās from al-Shinqīṭī's 1389 AH Ramaḍān lessons: defence of qiyās against Ibn Ḥazm, Iblīs's qiyās. Used only for the appendix."
  },
  {
   "witness": "shamela-266",
   "chapter_span": "src:shamela-266/v01:p290 .. src:shamela-266/v01:p355",
   "notes": "Al-Shinqīṭī, Ādāb al-Baḥth wa-l-Munāẓara: application of munāẓara categories (naqḍ ijmālī, manʿ/munāqaḍa, muʿāraḍa) to the uṣūl qawādiḥ — naqḍ p295, kasr p302, qalb/muʿāraḍa p318, fasād al-iʿtibār p330, fasād al-waḍʿ p333, taqsīm p338, ʿadam al-taʾthīr p340, qawl bi-l-mūjab p345, qadḥ fī l-ifḍāʾ p350, khafāʾ p352, ʿadam al-inḍibāṭ p353, mukhālafat ḥukm al-farʿ p354."
  },
  {
   "witness": "shamela-9942",
   "chapter_span": "src:shamela-9942/v01:p068 .. src:shamela-9942/v01:p074",
   "notes": "Ibn ʿUthaymīn, al-Uṣūl min ʿIlm al-Uṣūl: short qiyās chapter (definition, proofs, five conditions, jalī/khafī, shabah, ʿaks); tarjīḥ line at p082. Modern: excerpts ≤160 chars."
  },
  {
   "witness": "archive-tariq-tess",
   "chapter_span": "scattered: src:archive-tariq-tess/v01:p064, p098, p217, p220",
   "notes": "Al-Saʿdī, Ṭarīq al-Wuṣūl: numbered extracts from Ibn Taymiyya and Ibn al-Qayyim; no qiyās chapter. OCR noisy; verbatim excerpts keep OCR noise. Modern: ≤160 chars."
  }
 ],
 "formalises": {
  "definition": [
   "Usul.Schema.Factors.qiyas"
  ],
  "rukn:general": [
   "Usul.Qiyas.Argument",
   "Usul.Qiyas.gate",
   "Usul.Qiyas.Agrees",
   "Usul.Qiyas.qiyas_sound",
   "Usul.Qiyas.gate_consistent"
  ],
  "rukn:asl": [
   "Usul.Qiyas.gate",
   "Usul.Jadal.Qadih.succeeds"
  ],
  "rukn:far": [
   "Usul.Qiyas.TahqiqManat",
   "Usul.Qiyas.gate"
  ],
  "rukn:hukm": [
   "Usul.Jadal.debateGate_sound"
  ],
  "rukn:illa": [
   "Usul.Qiyas.Wasf",
   "Usul.Schema.Factors"
  ],
  "masalik:tard": [
   "Usul.Qiyas.tard_iff",
   "Usul.Qiyas.tard_vacuous"
  ],
  "masalik:dawaran": [
   "Usul.Qiyas.dawaran_iff",
   "Usul.Qiyas.dawaran_not_unique",
   "Usul.Qiyas.dawaran"
  ],
  "masalik:sabr_taqsim": [
   "Usul.Qiyas.sabr_sound",
   "Usul.Qiyas.sabr_needs_hasr"
  ],
  "masalik:munasaba": [
   "Usul.Qiyas.Munasib",
   "Usul.Qiyas.munasaba_of_q01",
   "Usul.Qiyas.Recognition.accepted",
   "Usul.Qiyas.Recognition",
   "Usul.Qiyas.mulgha_never_accepted"
  ],
  "masalik:shabah": [
   "Usul.Qiyas.shabahAsl",
   "Usul.Qiyas.shabah_optimal"
  ],
  "masalik:tanqih_al_manat": [
   "Usul.Qiyas.tanqih_manat"
  ],
  "masalik:takhrij_al_manat": [
   "Usul.Qiyas.sabr_sound"
  ],
  "masalik:tahqiq_al_manat": [
   "Usul.Qiyas.TahqiqManat"
  ],
  "masalik:nass_sarih": [
   "Usul.Qiyas.IllaSource"
  ],
  "masalik:ima": [
   "Usul.Qiyas.IllaSource"
  ],
  "masalik:ijma": [
   "Usul.Qiyas.IllaSource"
  ],
  "masalik:general": [
   "Usul.Jadal.Maslak"
  ],
  "qadih:naqd": [
   "Usul.Qiyas.naqd_defeats",
   "Usul.Qiyas.naqd_iff_not_tard",
   "Usul.Qiyas.Naqd"
  ],
  "qadih:man": [
   "Usul.Qiyas.man_defeats"
  ],
  "qadih:farq": [
   "Usul.Qiyas.farq_defeats"
  ],
  "qadih:muarada": [
   "Usul.Jadal.counter_resolved_by_tarjih"
  ],
  "qadih:qalb": [
   "Usul.Qiyas.qalb_defeats"
  ],
  "qadih:qawl_bil_mujab": [
   "Usul.Qiyas.qawlBiMujab_defeats"
  ],
  "qadih:fasad_al_itibar": [
   "Usul.Qiyas.fasad_itibar",
   "Usul.Qiyas.qiyas_against_text_discarded"
  ],
  "qadih:fasad_al_wad": [
   "Usul.Qiyas.fasad_wad"
  ],
  "qadih:kasr": [
   "Usul.Qiyas.naqd_gives_kasr",
   "Usul.Qiyas.kasr_without_naqd"
  ],
  "qadih:adam_al_tathir": [
   "Usul.Qiyas.adamTathir_iff_not_aks",
   "Usul.Qiyas.AdamTathirSucceeds"
  ],
  "qadih:istifsar": [
   "Usul.Jadal.Qadih.succeeds",
   "Usul.Jadal.objection_blocks"
  ],
  "qadih:taqsim": [
   "Usul.Jadal.Qadih.succeeds",
   "Usul.Jadal.objection_blocks"
  ],
  "qadih:mutalaba": [
   "Usul.Jadal.Qadih.succeeds",
   "Usul.Jadal.objection_blocks"
  ],
  "qadih:tarkib": [
   "Usul.Jadal.Qadih.succeeds",
   "Usul.Jadal.debateGate_sound"
  ],
  "qadih:ikhtilaf_al_dabit": [
   "Usul.Jadal.Qadih.succeeds",
   "Usul.Jadal.objection_blocks"
  ],
  "qadih:mukhalafat_hukm": [
   "Usul.Jadal.Qadih.succeeds",
   "Usul.Jadal.debateGate_sound"
  ],
  "qadih:ifda": [
   "Usul.Jadal.Qadih.succeeds",
   "Usul.Jadal.objection_blocks"
  ],
  "qadih:inḍibat": [
   "Usul.Jadal.Qadih.succeeds",
   "Usul.Jadal.objection_blocks"
  ],
  "qadih:list": [
   "Usul.Jadal.Qadih.all",
   "Usul.Jadal.debateGate_holds_iff",
   "Usul.Jadal.debateGate"
  ],
  "qadih:order": [
   "Usul.Jadal.Qadih.kind",
   "Usul.Jadal.kind_spec"
  ],
  "takhsis_illa": [
   "Usul.Qiyas.takhsis_repairs",
   "Usul.Qiyas.NaqdSucceedsBy",
   "Usul.Qiyas.naqd_succeeds_without_takhsis",
   "Usul.Qiyas.naqd_answered_by_takhsis"
  ],
  "type:aks": [
   "Usul.Jadal.qiyas_aks"
  ],
  "type:dalala": [
   "Usul.Jadal.dalala_verifies"
  ],
  "type:illa_dalala": [
   "Usul.Jadal.dalala_verifies"
  ],
  "type:awla_musawi": [
   "Usul.Jadal.qiyas_awla",
   "Usul.Jadal.qiyas_musawi"
  ],
  "type:shabah": [
   "Usul.Jadal.farByOrder",
   "Usul.Jadal.shabah_only_as_fallback",
   "Usul.Jadal.shabah_never_overrides_illa",
   "Usul.Jadal.shabah_rejected"
  ],
  "type:illa_dalala_shabah": [
   "Usul.Jadal.farByOrder"
  ],
  "type:nafy_al_fariq": [
   "Usul.Qiyas.tanqih_manat"
  ],
  "tarjih": [
   "Usul.Jadal.preferred_optimal",
   "Usul.Jadal.RespectsSources"
  ],
  "ibn_qayyim:no_conflict": [
   "Usul.Qiyas.qiyas_against_text_discarded"
  ],
  "ibn_taymiyya:no_contra_qiyas": [
   "Usul.Qiyas.qiyas_against_text_discarded"
  ],
  "ibn_qayyim:sahih_fasid": [
   "Usul.Schema.Factors.qiyas",
   "Usul.Qiyas.farq_defeats"
  ],
  "scope:hudud_kaffarat": [
   "Usul.Jadal.Qadih.succeeds"
  ]
 },
 "unformalised": {
  "hujjiyya": "the authority of qiyās is a premise of the model, not derived in it",
  "masalik:shahadat_al_usul": "testimony of the uṣūl (disputed maslak) not yet modelled",
  "type:jali_khafi": "the clear/hidden grading is not yet modelled",